{
  "schema_version": 1,
  "scenario_id": "SC-103",
  "type": "positive",
  "description": "El plan descompone el encargo en unidades con objetivo, archivos, capacidades, verificación y presupuesto por unidad.",
  "input": {
    "skill": "writing-plans",
    "units_with_verification_criteria": "all",
    "units_with_budget": "all"
  },
  "expected": {
    "verdict": "PASS",
    "evidence_type": "plan_document",
    "description": "Todas las unidades declaran verificación observable y presupuesto; el plan es documento sin efectos."
  },
  "sr_links": [],
  "target_skill": "writing-plans"
}
